{
  "schema_version": 1, "config_digest": "sha256:89f69f97fd129c690adb7465a7aa495e196cc66fab212c5421e45403eb9dad7c",
  "runtime": {"distribution": "release", "rapid_mlx": "0.14.0", "mlx": "0.32.1", "mflux": "0.12.0", "python": "3.12.11"},
  "task_type": "image_generation", "resources": {"max_concurrency": 1, "compute_dtype": "bfloat16", "offload": "none"},
  "task": {"kind": "image_generation", "diffusion": {"attention_backend": "native", "compilation": "disabled", "vae_tiling": false, "vae_slicing": false, "denoiser_chunk_size": null}}
}
